{
  "skill_name": "differential-test-harness-gen",
  "positive_prompts": [
    {
      "prompt": "Use differential-test-harness-gen to build a cross-implementation differential harness for our Ed25519 verifier: replay the Wycheproof EdDSA test vectors, compare our accept/reject decisions against a reference library, normalize error semantics, and capture a deterministic corpus of divergences as evidence for crypto-fp-check.",
      "expected_route": "differential-test-harness-gen"
    },
    {
      "prompt": "Explicitly invoke differential-test-harness-gen to generate a test harness that runs our ML-KEM decapsulation against the official ACVP vectors and a second implementation, records any shared-secret or reject-behavior mismatch, and produces a reproduction command for each discrepancy.",
      "expected_route": "differential-test-harness-gen"
    }
  ],
  "negative_prompts": [
    {
      "prompt": "Audit our snarkjs-generated Solidity Groth16 verifier for missing scalar-field checks on public inputs and pairing precompile return-value handling.",
      "expected_route": "onchain-verifier-auditor"
    },
    {
      "prompt": "Review our Ed25519 library's canonical s range enforcement, small-order point handling, and batch versus single verification consistency.",
      "expected_route": "signature-scheme-auditor"
    }
  ],
  "required_sources": [
    "Project Wycheproof"
  ],
  "required_output_fields": [
    "implementations_compared",
    "vector_or_corpus_source",
    "normalization_rules",
    "reproduction_command",
    "evidence_artifacts",
    "next_route"
  ],
  "forward_test_notes": [
    {
      "prompt_kind": "positive",
      "observed_route": "differential-test-harness-gen",
      "output_fields_present": [
        "implementations_compared",
        "vector_or_corpus_source",
        "normalization_rules",
        "reproduction_command",
        "evidence_artifacts",
        "next_route"
      ]
    },
    {
      "prompt_kind": "negative",
      "observed_route": "onchain-verifier-auditor",
      "output_fields_present": [
        "affected_component",
        "precompile_or_verifier_path",
        "invariant_at_risk",
        "evidence",
        "disposition",
        "next_route"
      ]
    }
  ]
}
