{
  "skill_name": "pqc-kem-auditor",
  "positive_prompts": [
    {
      "prompt": "Audit our ML-KEM-768 decapsulation path against FIPS 203: the Fujisaki-Okamoto re-encryption comparison, whether implicit rejection returns the derived pseudo-random key K-bar without any observable difference from the success path, and ciphertext validation before decapsulation.",
      "expected_route": "pqc-kem-auditor"
    },
    {
      "prompt": "Review this Kyber/ML-KEM implementation's encapsulation and serialization: modulus checks on the encoded public key, compression and rounding of the ciphertext coefficients, and whether a malformed ciphertext can turn the decapsulation failure path into a key-recovery oracle across many queries.",
      "expected_route": "pqc-kem-auditor"
    }
  ],
  "negative_prompts": [
    {
      "prompt": "Audit our ML-DSA-65 signing implementation: the rejection-sampling loop bounds, hint computation, and whether signature verification enforces the z norm bounds from FIPS 204.",
      "expected_route": "pqc-signature-auditor"
    },
    {
      "prompt": "Review the LWE parameter selection for our custom encryption scheme: the noise distribution width relative to the modulus, estimated core-SVP hardness for the chosen dimension, and whether the decryption failure probability supports the claimed security level. This is a bespoke construction, not a standardized KEM.",
      "expected_route": "lattice-auditor"
    }
  ],
  "required_sources": [
    "FIPS 203"
  ],
  "required_output_fields": [
    "kem_family_and_parameter_set",
    "encapsulation_or_decapsulation_path",
    "failure_oracle_invariant",
    "evidence",
    "disposition",
    "next_route"
  ],
  "forward_test_notes": [
    {
      "prompt_kind": "positive",
      "observed_route": "pqc-kem-auditor",
      "output_fields_present": [
        "kem_family_and_parameter_set",
        "encapsulation_or_decapsulation_path",
        "failure_oracle_invariant",
        "evidence",
        "disposition",
        "next_route"
      ]
    },
    {
      "prompt_kind": "negative",
      "observed_route": "lattice-auditor",
      "output_fields_present": [
        "parameter set/sampling routine/decapsulation path involved",
        "concrete failure bound or bias condition at risk",
        "parameter/sampling/seed-separation/reject-path classification",
        "next verification or reporting route"
      ]
    }
  ]
}
