{
  "skill_name": "pqc-signature-auditor",
  "positive_prompts": [
    {
      "prompt": "Audit our ML-DSA-65 implementation against FIPS 204: the rejection-sampling loop and its iteration bounds, hint vector computation, deterministic versus hedged signing modes, and whether verification enforces the z norm bound and hint weight limits.",
      "expected_route": "pqc-signature-auditor"
    },
    {
      "prompt": "Review our SLH-DSA (SPHINCS+) signing service under FIPS 205: the FORS tree addressing, WOTS+ chain computation, and whether the randomizer opt_rand is generated per the hedged variant so that signing the same message twice cannot reuse one-time key material unsafely.",
      "expected_route": "pqc-signature-auditor"
    },
    {
      "prompt": "Audit our XMSS signing infrastructure under NIST SP 800-208: the monotonic OTS index counter persistence across crashes and restarts, backup/restore procedures that could roll the index back, and whether signing nodes can be cloned in a way that reuses a one-time signature key.",
      "expected_route": "pqc-signature-auditor"
    }
  ],
  "negative_prompts": [
    {
      "prompt": "Audit our ML-KEM-768 decapsulation and implicit rejection handling against FIPS 203, including ciphertext validation and the constant-time comparison in the Fujisaki-Okamoto transform.",
      "expected_route": "pqc-kem-auditor"
    },
    {
      "prompt": "Review this Ed25519 signature library for canonical s range enforcement, small-order point handling, and batch versus single verification consistency. It is a classical elliptic-curve signature scheme, no post-quantum algorithms involved.",
      "expected_route": "signature-scheme-auditor"
    }
  ],
  "required_sources": [
    "FIPS 204",
    "FIPS 205",
    "NIST SP 800-208"
  ],
  "required_output_fields": [
    "signature_family_and_parameter_set",
    "sign_or_verify_path",
    "state_or_sampling_invariant",
    "evidence",
    "disposition",
    "next_route"
  ],
  "forward_test_notes": [
    {
      "prompt_kind": "positive",
      "observed_route": "pqc-signature-auditor",
      "output_fields_present": [
        "signature_family_and_parameter_set",
        "sign_or_verify_path",
        "state_or_sampling_invariant",
        "evidence",
        "disposition",
        "next_route"
      ]
    },
    {
      "prompt_kind": "negative",
      "observed_route": "pqc-kem-auditor",
      "output_fields_present": [
        "kem_family_and_parameter_set",
        "encapsulation_or_decapsulation_path",
        "failure_oracle_invariant",
        "evidence",
        "disposition",
        "next_route"
      ]
    }
  ]
}
