{
  "skill_name": "zkvm-auditor",
  "positive_prompts": [
    {
      "prompt": "Audit our zkEVM's EVM opcode equivalence: does the circuit implementation of the arithmetic and memory-expansion opcodes match mainnet EVM semantics, including gas accounting divergence between the L2 circuit and geth, and the state/storage trie encoding used for the account and storage roots? This is a Scroll/Polygon-zkEVM-style prover, not a general RISC-V zkVM.",
      "expected_route": "zkvm-auditor"
    },
    {
      "prompt": "Review the precompile equivalence in our Linea zkEVM: are the ECRECOVER, MODEXP, and pairing precompiles constrained to produce exactly the mainnet EVM results, and does memory expansion during CALL match EVM gas and memory semantics so a proof cannot attest to a divergent state transition?",
      "expected_route": "zkvm-auditor"
    }
  ],
  "negative_prompts": [
    {
      "prompt": "Audit our SP1 RISC-V guest program: the keccak precompile constraints, continuation-proof segment handoff of registers and memory, and whether host-supplied values entering the guest are validated in-circuit. This is a general-purpose RISC-V zkVM, not an EVM-equivalence prover.",
      "expected_route": "zkvm-auditor"
    },
    {
      "prompt": "Audit our snarkjs-generated Solidity Groth16 verifier contract for missing scalar-field checks on public inputs and pairing precompile return-value handling on-chain.",
      "expected_route": "onchain-verifier-auditor"
    }
  ],
  "required_sources": [
    "Ethereum Yellow Paper"
  ],
  "required_output_fields": [
    "opcode_or_precompile_equivalence",
    "gas_or_circuit_divergence",
    "state_or_storage_encoding",
    "next verification or reporting route"
  ],
  "forward_test_notes": [
    {
      "prompt_kind": "positive",
      "observed_route": "zkvm-auditor",
      "output_fields_present": [
        "opcode_or_precompile_equivalence",
        "gas_or_circuit_divergence",
        "state_or_storage_encoding",
        "affected precompile/syscall/memory table/continuation segment",
        "next verification or reporting route"
      ]
    },
    {
      "prompt_kind": "negative",
      "observed_route": "onchain-verifier-auditor",
      "output_fields_present": [
        "affected_component",
        "precompile_or_verifier_path",
        "invariant_at_risk",
        "evidence",
        "disposition",
        "next_route"
      ]
    }
  ]
}
